{"policy_id":"27fa6dd768b4334c12f38f410a4b3d9ed403577cf42dd4e14d3d1df3fd976c7e","snapshot_file_sha256":"df1e1b91aaa8390fc8a11153f96218dfa6ff09eb503f05b491e472a6bd2816b2","snapshot_id":"00000000-0000-4000-8000-000000000014","source_contract_version":"0.1.0","source_schema_version":"1","workspace_id":"00000000-0000-4000-8000-000000000001"}