{"policy_id":"27fa6dd768b4334c12f38f410a4b3d9ed403577cf42dd4e14d3d1df3fd976c7e","snapshot_file_sha256":"0e5e6178f6958d9ba3a04b1a157ac5cf7dbb7016965a744473dc768eba4b5799","snapshot_id":"00000000-0000-4000-8000-000000000016","source_contract_version":"0.1.0","source_schema_version":"1","workspace_id":"00000000-0000-4000-8000-000000000001"}