{"policy_id":"27fa6dd768b4334c12f38f410a4b3d9ed403577cf42dd4e14d3d1df3fd976c7e","snapshot_file_sha256":"464fb8647747f940f3442360e6b1c657ff1f7e85b4f1d4633a261bebc3ff10c7","snapshot_id":"00000000-0000-4000-8000-000000000018","source_contract_version":"0.1.0","source_schema_version":"1","workspace_id":"00000000-0000-4000-8000-000000000001"}