{"policy_id":"27fa6dd768b4334c12f38f410a4b3d9ed403577cf42dd4e14d3d1df3fd976c7e","snapshot_file_sha256":"73a47af37423dc5192e28f3543bef6f0dc1cec63eba5cf2fbf1cdbec59c96d49","snapshot_id":"00000000-0000-4000-8000-000000000017","source_contract_version":"0.1.0","source_schema_version":"1","workspace_id":"00000000-0000-4000-8000-000000000001"}