{"policy_id":"27fa6dd768b4334c12f38f410a4b3d9ed403577cf42dd4e14d3d1df3fd976c7e","snapshot_file_sha256":"de5260e72981a1ea1de817d28ee7d4abcfb30ed4e4c15fb9bc6fe3f22e2f8469","snapshot_id":"00000000-0000-4000-8000-000000000015","source_contract_version":"0.1.0","source_schema_version":"1","workspace_id":"00000000-0000-4000-8000-000000000001"}