{"policy_id":"27fa6dd768b4334c12f38f410a4b3d9ed403577cf42dd4e14d3d1df3fd976c7e","snapshot_file_sha256":"c045e22ba8c915acd5e82fece4019486ceede421fe5a36c68a2624ffb1c84b05","snapshot_id":"00000000-0000-4000-8000-000000000013","source_contract_version":"0.1.0","source_schema_version":"1","workspace_id":"00000000-0000-4000-8000-000000000001"}