{"policy_id":"27fa6dd768b4334c12f38f410a4b3d9ed403577cf42dd4e14d3d1df3fd976c7e","snapshot_file_sha256":"bf281e683a1b6997728ea66166f725d7f2f5ada0f5a1926951a1ddf49f24bd0f","snapshot_id":"00000000-0000-4000-8000-000000000011","source_contract_version":"0.1.0","source_schema_version":"1","workspace_id":"00000000-0000-4000-8000-000000000001"}