{"policy_id":"27fa6dd768b4334c12f38f410a4b3d9ed403577cf42dd4e14d3d1df3fd976c7e","snapshot_file_sha256":"53faa50e3d2379a11c1238adb85af4199767369f8b62aa2cff18e65cd5f91d3f","snapshot_id":"00000000-0000-4000-8000-000000000012","source_contract_version":"0.1.0","source_schema_version":"1","workspace_id":"00000000-0000-4000-8000-000000000001"}